{"type":"config","name":"Improve WebRTC streaming throughput toward TCP","metricName":"webrtc_direct_tcp_ratio","metricUnit":"","bestDirection":"higher"}
{"run":1,"commit":"5969607","metric":0.060045318650684625,"metrics":{},"status":"checks_failed","description":"baseline: add autoresearch harness for tcp vs webrtc-direct throughput ratio; benchmark passes at ~0.0600 ratio but checks failed because package-local test script could not find aegir via pnpm filter","timestamp":1773628073739,"segment":0}
{"run":2,"commit":"41ee014","metric":0.06526516524277359,"metrics":{},"status":"keep","description":"baseline: add autoresearch benchmark/check harness and validate current WebRTC Direct throughput ratio at ~0.0653 vs tcp","timestamp":1773628180622,"segment":0}
{"run":3,"commit":"41ee014","metric":0.06389884493971894,"metrics":{},"status":"discard","description":"try resuming WebRTC stream writes at maxBufferedAmount instead of waiting for full drain by setting bufferedAmountLowThreshold to the high-water mark; no improvement on throughput ratio","timestamp":1773628269669,"segment":0}
{"run":4,"commit":"41ee014","metric":0,"metrics":{},"status":"crash","description":"try flattening each framed WebRTC message into a single RTCDataChannel send call to reduce per-message overhead; crashed during benchmark with libdatachannel reporting DataChannel is closed on bufferedamountlow resume","timestamp":1773628356785,"segment":0}
{"run":5,"commit":"41ee014","metric":0,"metrics":{},"status":"crash","description":"try using negotiated SCTP maxMessageSize for streams and stop hard-capping WebRTC Direct peer connections at 16KiB; benchmark crashed with WebRTC stream resets during throughput","timestamp":1773628741152,"segment":0}
{"run":6,"commit":"f1f1a12","metric":0.06166344059973881,"metrics":{},"status":"keep","description":"harness: build @libp2p/webrtc before benchmarking so measurements use current source instead of stale dist artifacts; refreshed valid baseline at ~0.0617 ratio","timestamp":1773628813170,"segment":0}
{"run":7,"commit":"f1f1a12","metric":0,"metrics":{},"status":"crash","description":"try matching the documented 16MiB default bufferedAmount cap and resuming writes at the high-water mark instead of full drain; webrtc-direct upload produced no throughput data and stalled","timestamp":1773628868754,"segment":0}
{"run":8,"commit":"f1f1a12","metric":0.059781148948625754,"metrics":{},"status":"discard","description":"try resuming WebRTC writes when bufferedAmount falls below half the high-water mark to reduce full-drain bursts; throughput ratio regressed","timestamp":1773628951246,"segment":0}
{"run":9,"commit":"f1f1a12","metric":0.06130725288383822,"metrics":{},"status":"discard","description":"try manually encoding data-only protobuf+length-prefixed frames into a single contiguous buffer so each payload chunk becomes one RTC message; first measurement was slightly below baseline","timestamp":1773629397117,"segment":0}
{"run":10,"commit":"f1f1a12","metric":0.06171784763426515,"metrics":{},"status":"discard","description":"rerun manual contiguous data-frame encoding to check noise; second measurement was effectively flat vs baseline, so no convincing improvement","timestamp":1773629405105,"segment":0}
{"run":11,"commit":"4a40895","metric":0.062479332429908815,"metrics":{},"status":"keep","description":"tune node-datachannel SCTP defaults on Node by raising send/receive buffer sizes to 4MiB each before creating peer connections; improves webrtc-direct throughput ratio to ~0.0625","timestamp":1773629741579,"segment":0}
{"run":12,"commit":"4a40895","metric":0.060574460803786694,"metrics":{},"status":"discard","description":"add a larger SCTP maxChunksOnQueue on top of 4MiB send/receive buffers; throughput ratio regressed","timestamp":1773629832419,"segment":0}
{"run":13,"commit":"9000659","metric":0.06538383313180246,"metrics":{},"status":"keep","description":"increase node-datachannel SCTP send/receive buffers further to 8MiB on Node; improves webrtc-direct throughput ratio to ~0.0654","timestamp":1773629907580,"segment":0}
{"run":14,"commit":"9000659","metric":0.0593410764518139,"metrics":{},"status":"discard","description":"increase node-datachannel SCTP send/receive buffers further to 16MiB on Node; throughput ratio regressed sharply","timestamp":1773629971814,"segment":0}
